{"$schema":"https://json-schema.org/draft/2020-12/schema","$id":"https://schemas.socioprophet.org/model-governance-ledger/orggov-model-tool-receipt.v0.1.schema.json","title":"OrgGov Model Tool Receipt v0.1","type":"object","additionalProperties":false,"required":["schemaVersion","recordType","recordId","workroomRef","workOrderRef","actorRef","sessionRef","modelRouteRef","toolRefs","datasetRefs","contextBoundaryRefs","evalRefs","promotionPosture","outputRefs","rollback","revocation","evidenceRefs","provenance"],"properties":{"schemaVersion":{"const":"orggov.model-tool-receipt.v0.1"},"recordType":{"const":"OrgGovModelToolReceipt"},"recordId":{"type":"string"},"workroomRef":{"type":"string"},"workOrderRef":{"type":"string"},"actorRef":{"type":"string"},"sessionRef":{"type":"string"},"modelRouteRef":{"type":"string"},"adapterRef":{"type":"string"},"toolRefs":{"type":"array","items":{"type":"string"}},"datasetRefs":{"type":"array","items":{"type":"string"}},"contextBoundaryRefs":{"type":"array","items":{"type":"string"}},"evalRefs":{"type":"array","items":{"type":"string"}},"promotionPosture":{"type":"string","enum":["not_applicable","draft","blocked","review_required","approved","revoked"]},"outputRefs":{"type":"array","items":{"type":"string"}},"rollback":{"type":"object","additionalProperties":false,"required":["supported","rollbackRef"],"properties":{"supported":{"type":"boolean"},"rollbackRef":{"type":"string"}}},"revocation":{"type":"object","additionalProperties":false,"required":["supported","revocationRef"],"properties":{"supported":{"type":"boolean"},"revocationRef":{"type":"string"}}},"evidenceRefs":{"type":"array","minItems":1,"items":{"type":"string"}},"provenance":{"type":"object","additionalProperties":false,"required":["createdBy","createdAt","nonSecret"],"properties":{"createdBy":{"type":"string"},"createdAt":{"type":"string"},"nonSecret":{"type":"boolean"}}},"labels":{"type":"object","additionalProperties":{"type":"string"}}}}
