{"schemaVersion":"orggov.model-tool-receipt.v0.1","recordType":"OrgGovModelToolReceipt","recordId":"model-tool-receipt:orggov-v0:contract-spine","workroomRef":"workroom:orggov-v0","workOrderRef":"workorder:prophet-platform:406","actorRef":"actor:orggov-planning-agent","sessionRef":"agentplane://artifacts/orggov/session-artifact.json","modelRouteRef":"model-router://route/orggov-planning-local-or-hosted-fallback","adapterRef":"adapter://not-applicable/orggov-fixture","toolRefs":["github://SocioProphet/prophet-platform","github://SocioProphet/ontogenesis","github://SocioProphet/prophet-workspace","github://SocioProphet/agent-registry","github://SocioProphet/policy-fabric","github://SocioProphet/agentplane"],"datasetRefs":["dataset://none-public-fixture-only"],"contextBoundaryRefs":["context-boundary://public-github-orggov-fixtures","policy://orggov/planning-agent"],"evalRefs":["eval://orggov/non-secret-fixture-validation","github://SocioProphet/agentplane/pull/128"],"promotionPosture":"review_required","outputRefs":["github://SocioProphet/prophet-platform/pull/409","github://SocioProphet/ontogenesis/pull/43","github://SocioProphet/prophet-workspace/pull/16","github://SocioProphet/agent-registry/pull/23","github://SocioProphet/policy-fabric/pull/61","github://SocioProphet/agentplane/pull/128"],"rollback":{"supported":true,"rollbackRef":"rollback://orggov/revert-fixture-and-contract-prs"},"revocation":{"supported":true,"revocationRef":"revocation://orggov/disable-agent-grants-and-model-route"},"evidenceRefs":["github://SocioProphet/prophet-platform/issues/406","github://SocioProphet/model-governance-ledger/issues/13"],"provenance":{"createdBy":"model-governance-ledger://orggov-fixture","createdAt":"2026-05-06T17:45:00Z","nonSecret":true},"labels":{"program":"orggov-v0","parent":"SocioProphet/prophet-platform#406","ledgerIssue":"SocioProphet/model-governance-ledger#13"}}
